venueName,address,venueType,originLocation,venueDesc
Draftland Hong Kong,"63 Wyndham St, Central, Hong Kong",Cocktail Bar,Hong Kong,"Life is now: with more than one way to enjoy cocktails. Draft Land is the first bar in Asia to pioneer only cocktails on tap, making the experience more accessible and affordable, and bringing a lifestyle-oriented philosophy encompassing people, events, and music. Singapore marks the fifth Draft Land outpost after ZhongXiao, Xinyi, and Taichung in Taiwan, and Hong Kong. Discover the Perfect Blend of Drinks and Lifestyle. The concept behind Draft Land is to introduce a refreshing approach that appeals to both bartenders and customers. Something you can enjoy at any time, any where, and with anyone"
Heart of Darkness Saigon,"31D Lý Tự Trọng, Bến Nghé, Quận 1, Thành phố Hồ Chí Minh 70000, Vietnam",Craft Beer Bar,"Ho Chi Minh, Vietnam",Enjoy delicious food and refreshing craft beers in Saigon & Singapore at our restaurants. BOOK NOW. OUR BEERS. Explore our range of award-winning craft beer.
Pasteur Street Brewing Co.,"144 Pasteur, Bến Nghé, Quận 1, Thành phố Hồ Chí Minh 70000, Vietnam",Craft Beer Bar,"Ho Chi Minh, Vietnam",Pasteur Street Brewing Company is an award-winning craft brewery in Vietnam. Visit our Tap Rooms in Saigon & Hanoi to sample the best craft beer in Vietnam.
PK maltroom,"8A Đặng Tất, Phường Tân Định, Quận 1, Thành phố Hồ Chí Minh, Vietnam",Specialty Spirits Bar,"Ho Chi Minh, Vietnam","Rượu thơm, đèn dịu, nhạc êm, người hiền... Một quán nhỏ nơi phố vắng."
86 PROOF Whiskey Bar,"109 Xuân Thủy, Thảo Điền, Quận 2, Thành phố Hồ Chí Minh, Vietnam",Specialty Spirits Bar,"Ho Chi Minh, Vietnam",Your favourite neighbourhood whiskey & cocktail bar - where everyone knows your name. Low key chill vibes. Seriously high quality drinks
Whisgars,"16 Soi Sukhumvit 23, Khlong Toei Nuea, Watthana, Bangkok 10110, Thailand",Specialty Spirits Bar,"Bangkok, Thailand","As Bangkok's best-stocked whiskey and cigar lounge, Whisgars has the style and discreet luxury of a classic gentlemen's speakeasy."
Tokyo Confidential,"9F, THE V-CITY AZABU-JUBAN PLACE 1-chome, 6-1 Azabujuban, Minato City, Tokyo 106-0045, Japan",Cocktail Bar,"Tokyo, Japan","Celebrating high contrasts and delightful chaos, Tokyo Confidential draws inspiration from a house party that gets suitably rowdy, serving up cocktails, bar bites and champagne as well as top-notch hospitality to create a home for everyone. Unrivalled views of Tokyo Tower from the bar’s balcony and rooftop inspire TC's ethos, as the iconic landmark once served as a beacon of communication for the city. We invite you to Pull Up, Fess Up and discover the high contrasts of Tokyo Confidential over a drink or five..."
Mizunara: The Library,"4/F, Kiu Yin Commercial Building, 361-363 Lockhart Rd, Wan Chai, Hong Kong",Specialty Spirits Bar,Hong Kong,Japanese bar crafting artisanal experiences through bespoke cocktails & a diverse whisky collection.
House Welley Whisky Bar,"Unit A, 2nd Floor, 97 Wellington St, Central, Hong Kong",Specialty Spirits Bar,Hong Kong,"House Welley is a Whisky Bar founded by 3 enthusiasts in order to promote single malts appreciation. Through sharing interesting bottles and their stories, we are listed as one of ""50 Best Bars in Hong Kong"" by TimeOut for 4 consecutive years."
"Writers Bar, Raffles Singapore","1 Beach Rd, Singapore 189673",Specialty Spirits Bar,Singapore,"Nestled in the frontmost corner of The Lobby, Writers Bar features a solid brass bar counter, textured walls adorned with stylishly charming mementos and books, and an alluring chandelier whose many pearls of light shimmer with sophistication. A tribute to the illustrious authors who have resided at Raffles Singapore, referencing the literary legacy of Raffles, the alluring bar is a sophisticated refuge for intimate conversations over handcrafted tipples."
